{
  "schema_version": "0.1.0",
  "bank": {
    "title": "Example bank: IT security incident response and survey evaluation",
    "description": "Worked examples showing a sequential set, an ordered (diagnostic) item, and a standard summative item. All content is original.",
    "language": "en",
    "created": "2026-10-09",
    "generator": "mcq-item-writer 0.1.0",
    "defaults": {
      "purpose": "both",
      "assessment_type": "formative",
      "stakes": "low",
      "learner_level": "first-year IT support / introductory statistics students",
      "platform": "Moodle 4.x",
      "options_per_item": 4
    },
    "source_materials": [
      {
        "id": "SRC-IR",
        "title": "Module 3: First response to suspected malware",
        "location": "course-notes/module-3.pdf"
      },
      {
        "id": "SRC-STATS",
        "title": "Unit 2: Sampling and bias",
        "location": "course-notes/unit-2.pdf"
      }
    ]
  },
  "items": [
    {
      "id": "IR-RANSOM-01",
      "version": 1,
      "status": "draft",
      "format": "one-best-answer",
      "objective": {
        "id": "IR3.1",
        "text": "Choose the first containment action for a suspected malware infection."
      },
      "testing_point": "Recognises signs of active ransomware and prioritises isolating the affected machine over cleanup or recovery.",
      "content_area": "Incident response",
      "task": "choose-action",
      "cognitive_process": "apply",
      "cognitive_level": "application",
      "purpose": "both",
      "assessment_type": "formative",
      "difficulty_target": 0.72,
      "set_id": "SET-RANSOM",
      "set_position": 1,
      "stem": {
        "scenario": null,
        "data_table": null,
        "lead_in": "Which of the following is the most appropriate immediate action?"
      },
      "options": [
        {
          "label": "A",
          "text": "Disconnect the employee's laptop from the network",
          "correct": true,
          "feedback": "Correct. The changed file extensions and README files point to ransomware that is still running. Isolating the laptop first stops it from encrypting more of the shared drive or spreading to other machines. Recovery comes after containment.",
          "misconception": null
        },
        {
          "label": "B",
          "text": "Restore the shared drive from last night's backup",
          "correct": false,
          "feedback": "Restoring is part of recovery, but doing it now is premature. While the infected laptop is still connected, the malware can encrypt the restored files too. Contain the threat first, then restore.",
          "misconception": "Treats recovery as the first step, before containment."
        },
        {
          "label": "C",
          "text": "Run a full antivirus scan on the laptop",
          "correct": false,
          "feedback": "A scan may help later, but it takes time while the malware keeps working, and the endpoint tool has already missed this threat. Isolation stops the damage immediately; investigation and cleanup follow.",
          "misconception": "Assumes detection tools will resolve an active incident faster than containment."
        },
        {
          "label": "D",
          "text": "Send a firm-wide warning about the phishing email",
          "correct": false,
          "feedback": "Warning staff is worthwhile, but it doesn't stop the encryption already happening on this laptop and the shared drive. Contain the active infection first, then warn others.",
          "misconception": "Prioritises preventing new infections over containing the current one."
        }
      ],
      "shuffle": true,
      "people": [
        {
          "role": "help-desk analyst",
          "inclusion_reason": "none-stated"
        },
        {
          "role": "employee",
          "inclusion_reason": "none-stated"
        }
      ],
      "references": [
        {
          "source_id": "SRC-IR",
          "locator": "Section 3.2, 'Contain before you clean'"
        }
      ],
      "sme_review": {
        "required": false,
        "claims_to_verify": []
      },
      "audit": {
        "cover_the_options": {
          "passed": true,
          "stem_only_answer": "Isolate the infected laptop from the network.",
          "notes": "Stem-only answer matches key A."
        },
        "lint": [],
        "warnings": []
      },
      "tags": [
        "ransomware",
        "containment"
      ]
    },
    {
      "id": "IR-RANSOM-02",
      "version": 1,
      "status": "draft",
      "format": "one-best-answer",
      "objective": {
        "id": "IR3.2",
        "text": "Interpret new evidence during an incident to judge whether it has spread."
      },
      "testing_point": "Infers lateral spread from new reports on other machines by users who did not receive the phishing email.",
      "content_area": "Incident response",
      "task": "explain",
      "cognitive_process": "analyze",
      "cognitive_level": "application",
      "purpose": "both",
      "assessment_type": "formative",
      "difficulty_target": 0.72,
      "set_id": "SET-RANSOM",
      "set_position": 2,
      "stem": {
        "scenario": null,
        "data_table": null,
        "lead_in": "Which of the following is the most likely explanation for these new reports?"
      },
      "options": [
        {
          "label": "A",
          "text": "A second phishing email reached other employees",
          "correct": false,
          "feedback": "A plausible thought, but the update says neither employee received the payroll email, and nothing suggests a second campaign. The evidence points to spread from the first infection.",
          "misconception": "Assumes each infection needs its own entry point."
        },
        {
          "label": "B",
          "text": "The malware spread before the laptop was isolated",
          "correct": true,
          "feedback": "Correct. About 25 minutes passed between the click and isolation. Ransomware often moves across shared drives and the network in that time, which is why containment speed matters and why the next step is to check other systems.",
          "misconception": null
        },
        {
          "label": "C",
          "text": "The backup system corrupted the file names",
          "correct": false,
          "feedback": "Backup faults don't rename files with a new extension and leave a README in every folder. The identical symptoms on another drive match the original malware, not a backup problem.",
          "misconception": "Attributes the symptoms to an unrelated system fault."
        },
        {
          "label": "D",
          "text": "The two employees opened the README files",
          "correct": false,
          "feedback": "The README files are the ransom notes the malware leaves after encrypting files. They are a symptom, not a cause, so opening them doesn't spread the infection.",
          "misconception": "Confuses the ransom note (an effect) with the infection mechanism."
        }
      ],
      "shuffle": true,
      "references": [
        {
          "source_id": "SRC-IR",
          "locator": "Section 3.4, 'Lateral movement'"
        }
      ],
      "audit": {
        "cover_the_options": {
          "passed": true,
          "stem_only_answer": "It spread from the first laptop before it was isolated.",
          "notes": ""
        },
        "lint": [],
        "warnings": []
      },
      "tags": [
        "ransomware",
        "lateral-movement"
      ]
    },
    {
      "id": "STATS-BIAS-01",
      "version": 1,
      "status": "draft",
      "format": "ordered-mc",
      "objective": {
        "id": "ST2.4",
        "text": "Evaluate whether a survey estimate is biased by how respondents were selected."
      },
      "testing_point": "Recognises self-selection bias and which direction it pushes the estimate, even when the sample is large.",
      "content_area": "Sampling and bias",
      "task": "interpret-data",
      "cognitive_process": "evaluate",
      "cognitive_level": "application",
      "purpose": "learning",
      "assessment_type": "formative",
      "difficulty_target": 0.77,
      "stem": {
        "scenario": "A city council surveys residents about a proposed bike lane by posting a link on a local cycling club's social-media page. 2,400 people respond, and 81% support the lane.",
        "data_table": null,
        "lead_in": "Which of the following is the best evaluation of the 81% figure?"
      },
      "options": [
        {
          "label": "A",
          "text": "It is trustworthy because the sample is large",
          "correct": false,
          "feedback": "A large sample reduces random error, but it can't fix who is in the sample. Here, everyone saw the link on a cycling club's page. Ask how respondents were chosen, not just how many there are.",
          "misconception": "Believes sample size alone guarantees accuracy.",
          "level": 1,
          "weight": 0
        },
        {
          "label": "B",
          "text": "It is accurate within normal random sampling error",
          "correct": false,
          "feedback": "Random sampling error is real, but it assumes respondents were picked at random. These respondents chose to respond after seeing a cycling club's post, so the error has a direction, not just a margin.",
          "misconception": "Knows estimates vary but attributes all error to chance, missing selection bias.",
          "level": 2,
          "weight": 0.5
        },
        {
          "label": "C",
          "text": "It likely overstates support because respondents selected themselves",
          "correct": true,
          "feedback": "Correct. People who follow a cycling club and choose to answer are more likely to support bike lanes, so the 81% probably overstates support among all residents. A large sample doesn't remove this bias.",
          "misconception": null,
          "level": 3,